{
  "$schema": "https://json-schema.org/draft/2019-09/schema",
  "$defs": {
    "string": {
      "type": "string",
      "minLength": 1
    }
  },
  "type": "object",
  "properties": {
    "entry": {
      "type": "object",
      "properties": {
        "loop": {
          "type": "object",
          "properties": {
            "Month": {
              "$ref": "#/$defs/string"
            },
            "Year": {
              "$ref": "#/$defs/string"
            }
          },
          "required": ["Month", "Year"]
        },
        "message": {
          "type": "object",
          "properties": {
            "AssignCategoriesByEdit": {
              "$ref": "#/$defs/string"
            },
            "DeleteConfirm": {
              "$ref": "#/$defs/string"
            },
            "NoCategoriesAssignedToShowFacts": {
              "$ref": "#/$defs/string"
            }
          },
          "required": [
            "AssignCategoriesByEdit",
            "DeleteConfirm",
            "NoCategoriesAssignedToShowFacts"
          ]
        },
        "property": {
          "type": "object",
          "properties": {
            "Loop": {
              "$ref": "#/$defs/string"
            },
            "Name": {
              "$ref": "#/$defs/string"
            }
          },
          "required": ["Loop", "Name"]
        },
        "title": {
          "type": "object",
          "properties": {
            "Create": {
              "$ref": "#/$defs/string"
            },
            "Delete": {
              "$ref": "#/$defs/string"
            }
          },
          "required": ["Create", "Delete"]
        },
        "type": {
          "type": "object",
          "properties": {
            "Expense": {
              "$ref": "#/$defs/string"
            },
            "Income": {
              "$ref": "#/$defs/string"
            }
          },
          "required": ["Expense", "Income"]
        },
        "validation": {
          "type": "object",
          "properties": {
            "EndDateAfterStartDate": {
              "$ref": "#/$defs/string"
            }
          },
          "required": ["EndDateAfterStartDate"]
        }
      },
      "required": ["loop", "message", "property", "title", "type", "validation"]
    },
    "page": {
      "type": "object",
      "properties": {
        "Title": {
          "$ref": "#/$defs/string"
        },
        "label": {
          "type": "object",
          "properties": {
            "Budgets": {
              "$ref": "#/$defs/string"
            },
            "Difference": {
              "$ref": "#/$defs/string"
            },
            "ExpensesByCategories": {
              "$ref": "#/$defs/string"
            },
            "Fact": {
              "$ref": "#/$defs/string"
            },
            "IncomesByCategories": {
              "$ref": "#/$defs/string"
            },
            "Plan": {
              "$ref": "#/$defs/string"
            },
            "Progress": {
              "$ref": "#/$defs/string"
            }
          },
          "required": [
            "Budgets",
            "Difference",
            "ExpensesByCategories",
            "Fact",
            "IncomesByCategories",
            "Plan",
            "Progress"
          ]
        }
      },
      "required": ["Title", "label"]
    },
    "period": {
      "type": "object",
      "properties": {
        "property": {
          "type": "object",
          "properties": {
            "Inherit": {
              "$ref": "#/$defs/string"
            }
          },
          "required": ["Inherit"]
        }
      },
      "required": ["property"]
    },
    "timeline": {
      "type": "object",
      "properties": {
        "label": {
          "type": "object",
          "properties": {
            "ShowAllCategories": {
              "$ref": "#/$defs/string"
            },
            "Totals": {
              "$ref": "#/$defs/string"
            }
          },
          "required": ["ShowAllCategories", "Totals"]
        }
      },
      "required": ["label"]
    }
  },
  "required": ["entry", "page", "period", "timeline"]
}
