{
  "entry": {
    "loop": {
      "Month": "Για μήνα",
      "Year": "Για το έτος"
    },
    "message": {
      "AssignCategoriesByEdit": "Σχεδιασμός ορισμένων κατηγοριών με \"Επεξεργασία\" κουμπί.",
      "DeleteConfirm": "Είστε βέβαιοι να διαγράψετε αυτόν τον προϋπολογισμό?",
      "NoCategoriesAssignedToShowFacts": "Δεν υπάρχουν προγραμματισμένες κατηγορίες από τις οποίες θα εμφανίζονται οι λειτουργίες."
    },
    "property": {
      "Loop": "Περίοδος",
      "Name": "Όνομα"
    },
    "title": {
      "Create": "Προσθήκη προϋπολογισμού",
      "Delete": "Διαγραφή προϋπολογισμού"
    },
    "type": {
      "Expense": "Έξοδα",
      "Income": "Εισοδήματα"
    },
    "validation": {
      "EndDateAfterStartDate": "Η ημερομηνία λήξης πρέπει να είναι μεταγενέστερη της ημερομηνίας έναρξης"
    }
  },
  "page": {
    "label": {
      "Budgets": "Προϋπολογισμοί",
      "Difference": "Διαφορά",
      "ExpensesByCategories": "Δαπάνες ανά κατηγορίες προϋπολογισμού:",
      "Fact": "Fact",
      "IncomesByCategories": "Εισοδήματα ανά κατηγορία προϋπολογισμού:",
      "Plan": "Σχέδιο",
      "Progress": "Πρόοδος"
    },
    "Title": "Προϋπολογισμός"
  },
  "period": {
    "property": {
      "Inherit": "Για όλες τις μελλοντικές περιόδους"
    }
  },
  "timeline": {
    "label": {
      "ShowAllCategories": "Εμφάνιση όλων",
      "Totals": "Σύνολο"
    }
  }
}
