{
  "entry": {
    "loop": {
      "Month": "Na měsíc",
      "Year": "Na rok"
    },
    "message": {
      "AssignCategoriesByEdit": "Naplánujte Kategorie pomocí tlačítka \"Upravit\".",
      "DeleteConfirm": "Opravdu chcete tento rozpočet smazat?",
      "NoCategoriesAssignedToShowFacts": "Žádné plánované kategorie pro zobrazení operací."
    },
    "property": {
      "Loop": "Období",
      "Name": "Název"
    },
    "title": {
      "Create": "Přidat rozpočet",
      "Delete": "Odstranit rozpočet"
    },
    "type": {
      "Expense": "Výdaje",
      "Income": "Příjmy"
    },
    "validation": {
      "EndDateAfterStartDate": "Datum ukončení by mělo být později než datum zahájení."
    }
  },
  "page": {
    "label": {
      "Budgets": "Rozpočet",
      "Difference": "Rozdíl",
      "ExpensesByCategories": "Výdaje podle rozpočtových kategorií:",
      "Fact": "Skutečnost",
      "IncomesByCategories": "Příjmy podle rozpočtových kategorií:",
      "Plan": "Plán",
      "Progress": "Provedení"
    },
    "Title": "Rozpočet"
  },
  "period": {
    "property": {
      "Inherit": "Pro všechny budoucí data"
    }
  },
  "timeline": {
    "label": {
      "ShowAllCategories": "Zobrazit vše",
      "Totals": "Celkem"
    }
  }
}
