{
  "entry": {
    "loop": {
      "Month": "For month",
      "Year": "For year"
    },
    "message": {
      "AssignCategoriesByEdit": "Plan some categories with \"Edit\" button.",
      "DeleteConfirm": "Are you sure to delete this budget?",
      "NoCategoriesAssignedToShowFacts": "No planned categories to show operations from."
    },
    "property": {
      "Loop": "Period",
      "Name": "Name"
    },
    "title": {
      "Create": "Add budget",
      "Delete": "Delete budget"
    },
    "type": {
      "Expense": "Expenses",
      "Income": "Incomes"
    },
    "validation": {
      "EndDateAfterStartDate": "End date must be after start date"
    }
  },
  "page": {
    "label": {
      "Budgets": "Budgets",
      "Difference": "Difference",
      "ExpensesByCategories": "Expenses by budget categories:",
      "Fact": "Fact",
      "IncomesByCategories": "Incomes by budget categories:",
      "Plan": "Plan",
      "Progress": "Progress"
    },
    "Title": "Budget"
  },
  "period": {
    "property": {
      "Inherit": "For all future periods"
    }
  },
  "timeline": {
    "label": {
      "ShowAllCategories": "Show all",
      "Totals": "Total"
    }
  }
}
